{
  "created_at": "2026-09-27T05:14:00Z",
  "files": [
    {
      "duplicate_of": null,
      "format": "ulog",
      "relative_path": "candidate-001.ulg",
      "sha256": "e85ec54ecd45a373ae3b3bcc24af985db5538d72e7a59fcac9ea7d70474b38c3",
      "size_bytes": 3950144
    },
    {
      "duplicate_of": null,
      "format": "ulog",
      "relative_path": "candidate-002.ulg",
      "sha256": "3b06a15aed92ece5c2499e2d694f2a9c2425d44a8cae7c9721b74eee312d302f",
      "size_bytes": 4004953
    },
    {
      "duplicate_of": null,
      "format": "ulog",
      "relative_path": "candidate-003.ulg",
      "sha256": "3fa3a61620797b143df9639c4f27a83a83e1964555640fa1a7e9522d54665866",
      "size_bytes": 4233702
    },
    {
      "duplicate_of": null,
      "format": "ulog",
      "relative_path": "candidate-004.ulg",
      "sha256": "9eba896483612580c6f5749d64e5f1f898c3a885a423726ba00c682d9b626e71",
      "size_bytes": 1355842
    },
    {
      "duplicate_of": null,
      "format": "ulog",
      "relative_path": "candidate-005.ulg",
      "sha256": "2483dc00415e2d5589d46638110655d42d324e0c3bf17aef43723c4cbb7473f3",
      "size_bytes": 1450832
    }
  ],
  "purpose": "phase_c_pilot_inventory",
  "schema_version": "1.0.0",
  "source_id": "uav-sead",
  "source_version": "774a336a1d1d06b248927a35c2ea1f6869e9e1a4",
  "summary": {
    "duplicate_count": 0,
    "file_count": 5,
    "formats": {
      "ulog": 5
    },
    "total_bytes": 14995473,
    "unique_bytes": 14995473,
    "unique_file_count": 5
  }
}
