{
  "created_at": "2026-09-27T05:13:00Z",
  "files": [
    {
      "duplicate_of": null,
      "format": "ulog",
      "relative_path": "candidate-001.ulg",
      "sha256": "8cac65a18f4fb80625ebcaebc188dadb837c6c69a1f4a8d92cb689f814046e62",
      "size_bytes": 3209413
    },
    {
      "duplicate_of": null,
      "format": "ulog",
      "relative_path": "candidate-002.ulg",
      "sha256": "10bd3b9b6c5ed7a0c1cd128c16fa25561df65aa385161c9528736f93f86467a0",
      "size_bytes": 3821839
    },
    {
      "duplicate_of": null,
      "format": "ulog",
      "relative_path": "candidate-003.ulg",
      "sha256": "d4f872c578a108a1818bc8d8b38775ecb3b1338bb97f276a7efbdff446b1320e",
      "size_bytes": 3849076
    },
    {
      "duplicate_of": null,
      "format": "ulog",
      "relative_path": "candidate-004.ulg",
      "sha256": "30c5ca76e11eccc0f1bda6b9ffa91f9d95b6a49e777eba0e79eaa1998c79e3b2",
      "size_bytes": 1334004
    },
    {
      "duplicate_of": null,
      "format": "ulog",
      "relative_path": "candidate-005.ulg",
      "sha256": "58cc53f0aaddf91b4515c1754601beb4ade320a3d506f09d6dfdc6c66be2fdcc",
      "size_bytes": 1343573
    }
  ],
  "purpose": "phase_c_pilot_inventory",
  "schema_version": "1.0.0",
  "source_id": "uav-sead",
  "source_version": "774a336a1d1d06b248927a35c2ea1f6869e9e1a4",
  "summary": {
    "duplicate_count": 0,
    "file_count": 5,
    "formats": {
      "ulog": 5
    },
    "total_bytes": 13557905,
    "unique_bytes": 13557905,
    "unique_file_count": 5
  }
}
