{
  "created_at": "2026-09-27T05:16:00Z",
  "files": [
    {
      "duplicate_of": null,
      "format": "ulog",
      "relative_path": "candidate-001.ulg",
      "sha256": "3b44dd1629ee5069e7efe12b36d306517c13f3c14eff3fa7f4cee35b1859b67b",
      "size_bytes": 5203965
    },
    {
      "duplicate_of": null,
      "format": "ulog",
      "relative_path": "candidate-002.ulg",
      "sha256": "5b200971c043b28de4b6d55d7d96aed2a3126b1c38c2a96502de17d2278dd243",
      "size_bytes": 5330622
    },
    {
      "duplicate_of": null,
      "format": "ulog",
      "relative_path": "candidate-003.ulg",
      "sha256": "4f2147d01a6a59155ec05754ee0d9ac3b589f869738835c69c9502f50cf39b30",
      "size_bytes": 7111927
    },
    {
      "duplicate_of": null,
      "format": "ulog",
      "relative_path": "candidate-004.ulg",
      "sha256": "b2f5154d32a2a2467c80f186f56dcf59a63eb7980c1f1a69b80f7b686ee6592f",
      "size_bytes": 1566166
    },
    {
      "duplicate_of": null,
      "format": "ulog",
      "relative_path": "candidate-005.ulg",
      "sha256": "ba64a8580a6752448e9bb8e38b094260081e84e241acff943518b53da6d19ff3",
      "size_bytes": 1631963
    }
  ],
  "purpose": "phase_c_pilot_inventory",
  "schema_version": "1.0.0",
  "source_id": "uav-sead",
  "source_version": "774a336a1d1d06b248927a35c2ea1f6869e9e1a4",
  "summary": {
    "duplicate_count": 0,
    "file_count": 5,
    "formats": {
      "ulog": 5
    },
    "total_bytes": 20844643,
    "unique_bytes": 20844643,
    "unique_file_count": 5
  }
}
