{
  "created_at": "2026-09-27T04:08:00Z",
  "files": [
    {
      "duplicate_of": null,
      "format": "ulog",
      "relative_path": "candidate-001.ulg",
      "sha256": "c0a0378108f775049c7ed928572b828c97d90c845d9f47641f172456e4c181c2",
      "size_bytes": 3715167
    },
    {
      "duplicate_of": null,
      "format": "ulog",
      "relative_path": "candidate-002.ulg",
      "sha256": "b188117b6315bd85eac12e627fe6a74add03d49752d44bf1bb33931378046fda",
      "size_bytes": 3861590
    },
    {
      "duplicate_of": null,
      "format": "ulog",
      "relative_path": "candidate-003.ulg",
      "sha256": "12c411107a085ce298ac5f80a290256f7e81b939b511a4dd8c3e36101d6c5032",
      "size_bytes": 4623108
    },
    {
      "duplicate_of": null,
      "format": "ulog",
      "relative_path": "candidate-004.ulg",
      "sha256": "ab23996193fb340f811508eccd5035cca98707b50046b3062854a70dc2a3ed6e",
      "size_bytes": 1036301
    },
    {
      "duplicate_of": null,
      "format": "ulog",
      "relative_path": "candidate-005.ulg",
      "sha256": "fc1e9ed9c1569ed06f1bb5727d4d0d019692906c66956a86373a1467ab660219",
      "size_bytes": 1055939
    }
  ],
  "purpose": "phase_c_pilot_inventory",
  "schema_version": "1.0.0",
  "source_id": "uav-sead",
  "source_version": "774a336a1d1d06b248927a35c2ea1f6869e9e1a4",
  "summary": {
    "duplicate_count": 0,
    "file_count": 5,
    "formats": {
      "ulog": 5
    },
    "total_bytes": 14292105,
    "unique_bytes": 14292105,
    "unique_file_count": 5
  }
}
