{
  "created_at": "2026-09-26T00:10:00Z",
  "files": [
    {
      "duplicate_of": null,
      "format": "ulog",
      "relative_path": "candidate-001.ulg",
      "sha256": "cbe844319e7bb26a790b3d591d146e25a94fe83893ce758a52ce0185e9ea15e2",
      "size_bytes": 11649174
    },
    {
      "duplicate_of": null,
      "format": "ulog",
      "relative_path": "candidate-002.ulg",
      "sha256": "d10ddb571acf61d790b5ac0f4301c17c5a827f5f8858eb016c9f4903f105b677",
      "size_bytes": 19038178
    },
    {
      "duplicate_of": null,
      "format": "ulog",
      "relative_path": "candidate-003.ulg",
      "sha256": "cdadf077d09c65e939207eb26be0baf16522a10b7fce58be57d3fb41c89d1109",
      "size_bytes": 4904938
    },
    {
      "duplicate_of": null,
      "format": "ulog",
      "relative_path": "candidate-004.ulg",
      "sha256": "c731cdec25ba505a7b4ff59c411095ccbb49ec8f6f74ccebc29f27497ba13d94",
      "size_bytes": 243413
    },
    {
      "duplicate_of": null,
      "format": "ulog",
      "relative_path": "candidate-005.ulg",
      "sha256": "c97e59d669f41deb05bde2c3264411de00ba9b6a9b6fd26a0a38d09564e17ffa",
      "size_bytes": 253535
    }
  ],
  "purpose": "phase_c_pilot_inventory",
  "schema_version": "1.0.0",
  "source_id": "uav-sead",
  "source_version": "774a336a1d1d06b248927a35c2ea1f6869e9e1a4",
  "summary": {
    "duplicate_count": 0,
    "file_count": 5,
    "formats": {
      "ulog": 5
    },
    "total_bytes": 36089238,
    "unique_bytes": 36089238,
    "unique_file_count": 5
  }
}
