{
  "created_at": "2026-09-27T07:27:00Z",
  "files": [
    {
      "duplicate_of": null,
      "format": "ulog",
      "relative_path": "candidate-001.ulg",
      "sha256": "40a8932ec4653968e2917e8a910ce29bf23cd82bfb26b6d16657b24262ef8c99",
      "size_bytes": 4252462
    },
    {
      "duplicate_of": null,
      "format": "ulog",
      "relative_path": "candidate-002.ulg",
      "sha256": "ac9ede9a151ec6b95d6bab410e696abba843a2a7f5b521c6722d48ae9f110cdf",
      "size_bytes": 4416952
    },
    {
      "duplicate_of": null,
      "format": "ulog",
      "relative_path": "candidate-003.ulg",
      "sha256": "e3d1388ff0eb98e54db3497cd1dd064c84e66de2096352ac02dbf8e34c190fde",
      "size_bytes": 4429761
    },
    {
      "duplicate_of": null,
      "format": "ulog",
      "relative_path": "candidate-004.ulg",
      "sha256": "c584fc575ec2c98f46a6c922d3a5e05464ccdf7b391cb88c38cff7f9cb3c4cbc",
      "size_bytes": 2672859
    },
    {
      "duplicate_of": null,
      "format": "ulog",
      "relative_path": "candidate-005.ulg",
      "sha256": "d4f0eaab3eddb0ca34b491d80d5218f06a63825c0394638fdbc2f70516c6eeaf",
      "size_bytes": 2729639
    }
  ],
  "purpose": "phase_c_pilot_inventory",
  "schema_version": "1.0.0",
  "source_id": "uav-sead",
  "source_version": "774a336a1d1d06b248927a35c2ea1f6869e9e1a4",
  "summary": {
    "duplicate_count": 0,
    "file_count": 5,
    "formats": {
      "ulog": 5
    },
    "total_bytes": 18501673,
    "unique_bytes": 18501673,
    "unique_file_count": 5
  }
}
