{
  "created_at": "2026-09-25T17:12:00Z",
  "files": [
    {
      "duplicate_of": null,
      "format": "ulog",
      "relative_path": "flight-001.ulg",
      "sha256": "536c1e7a8889aa0d8a7c95d3d17270a040a16d34a267de925d16d7389919b04c",
      "size_bytes": 7682509
    },
    {
      "duplicate_of": null,
      "format": "ulog",
      "relative_path": "flight-002.ulg",
      "sha256": "f42eadf04f8ccd59ddd02a91c880ce315408a975710e9e969ed44be1597f6401",
      "size_bytes": 4715969
    },
    {
      "duplicate_of": null,
      "format": "ulog",
      "relative_path": "flight-003.ulg",
      "sha256": "91a8e6ac4d8c08aa100b6be35b9ddd2f624022799557cea0651f8bd5dd002a5c",
      "size_bytes": 4499325
    },
    {
      "duplicate_of": null,
      "format": "ulog",
      "relative_path": "flight-004.ulg",
      "sha256": "5a5efc410805129a9cf29df64d314edd334c50780a5d0ae9c4349058b9d13751",
      "size_bytes": 12162878
    },
    {
      "duplicate_of": null,
      "format": "ulog",
      "relative_path": "flight-005.ulg",
      "sha256": "2ee6e18a40d72c1afe07ec7c3450bc3b54835d012c8aa54e1785e72c302ff708",
      "size_bytes": 2349195
    }
  ],
  "purpose": "phase_c_pilot_inventory",
  "schema_version": "1.0.0",
  "source_id": "uav-sead",
  "source_version": "774a336a1d1d06b248927a35c2ea1f6869e9e1a4",
  "summary": {
    "duplicate_count": 0,
    "file_count": 5,
    "formats": {
      "ulog": 5
    },
    "total_bytes": 31409876,
    "unique_bytes": 31409876,
    "unique_file_count": 5
  }
}
